XNSE/SUPREMEINF,Supreme Infrastructure India Ltd. (SUPREMEINF) Adjusted Stock Prices
XNSE/BANKBARODA,Bank of Baroda (BANKBARODA) Adjusted Stock Prices
XNSE/MADHUCON,Madhucon Projects Ltd. (MADHUCON) Adjusted Stock Prices
XNSE/N4RECLTD,Rural Electrification Corporation Ltd (N4RECLTD) Adjusted Stock Prices
XNSE/UTTAMVALUE,Uttam Value Steels Ltd (UTTAMVALUE) Adjusted Stock Prices
XNSE/BLUECHIP,Blue Chip India Ltd. (BLUECHIP) Adjusted Stock Prices
XNSE/NLSRTRANSFIN,Shriram Transport Finance Co. Ltd. (NLSRTRANSFIN) Adjusted Stock Prices
XNSE/CAPLIPOINT,Caplin Point Laboratories Ltd. (CAPLIPOINT) Adjusted Stock Prices
XNSE/CONSOFINVT,Consolidated Finvest & Holdings Ltd. (CONSOFINVT) Adjusted Stock Prices
XNSE/BONGAIREFN,Bongaigaon Refinery & Petrochemicals Ltd.
XNSE/MUNJALAU,Munjal Auto Industries Ltd. (MUNJALAU) Adjusted Stock Prices
XNSE/PARAL,Parekh Aluminex Ltd.
XNSE/ASIANPAINT,Asian Paints Ltd. (ASIANPAINT) Adjusted Stock Prices
XNSE/HONDAPOWER,Honda SIEL Power Products Ltd. (HONDAPOWER) Adjusted Stock Prices
XNSE/NAHARCAP,Nahar Capital & Financial Services Ltd. (NAHARCAP) Adjusted Stock Prices
XNSE/CENTBOP,Centurion Bank of Punjab Ltd. (CENTBOP) Adjusted Stock Prices
XNSE/PENPEBS,Pennar Engineered Building Systems Ltd. (PENPEBS) Adjusted Stock Prices
XNSE/N2SRTRANSFIN,Shriram Transport Finance Co. Ltd. (N2SRTRANSFIN) Adjusted Stock Prices
XNSE/AKZOINDIA,Akzo Nobel India Ltd. (AKZOINDIA) Adjusted Stock Prices
XNSE/IITL,Industrial Investment Trust Ltd. (IITL) Adjusted Stock Prices
XNSE/HDFC,Housing Development Finance Corporation Ltd. (HDFC) Adjusted Stock Prices
XNSE/NQSRTRANSFIN,Shriram Transport Finance Co. Ltd. (NQSRTRANSFIN) Adjusted Stock Prices
XNSE/N3IIFLFIN,India Infoline Finance Ltd (N3IIFLFIN) Adjusted Stock Prices
XNSE/BINDALAGRO,Oswal Green Tech Ltd (BINDALAGRO) Adjusted Stock Prices
XNSE/UNIENTER,Uniphos Enterprises Ltd. (UNIENTER) Adjusted Stock Prices
XNSE/KHANDSE,Khandwala Securities Ltd. (KHANDSE) Adjusted Stock Prices
XNSE/MFRFHFXX31GP,Reliance Capital Asset Management Ltd (MFRFHFXX31GP) Adjusted Stock Prices
XNSE/RTNPOWER,RattanIndia Power Ltd. (RTNPOWER) Adjusted Stock Prices
XNSE/NIITLTD,NIIT Ltd. (NIITLTD) Adjusted Stock Prices
XNSE/INDORAMTEX,Indo Rama Textiles Ltd. (INDORAMTEX) Adjusted Stock Prices
XNSE/ASSAMCO,Assam Co. India Ltd (ASSAMCO) Adjusted Stock Prices
XNSE/NIRMA,Nirma Ltd.
XNSE/KEMROCK,Kemrock Industries & Exports Ltd. (KEMROCK) Adjusted Stock Prices
XNSE/PEARLPOLY,Pearl Polymers Ltd. (PEARLPOLY) Adjusted Stock Prices
XNSE/GIPCL,Gujarat Industries Power Co. Ltd. (GIPCL) Adjusted Stock Prices
XNSE/ASIL,Amit Spinning Industries Ltd. (ASIL) Adjusted Stock Prices
XNSE/RANEHOLDIN,Rane Holdings Ltd. (RANEHOLDIN) Adjusted Stock Prices
XNSE/IPRINGLTD,IP Rings Ltd.
XNSE/VISUINTL,Visu International Ltd. (VISUINTL) Adjusted Stock Prices
XNSE/BANKINDIA,Bank of India (BANKINDIA) Adjusted Stock Prices
XNSE/JDORGOCHEM,J D Orgochem Ltd (JDORGOCHEM) Adjusted Stock Prices
XNSE/REPRO,Repro India Ltd. (REPRO) Adjusted Stock Prices
XNSE/N1TRENT,Trent Ltd. (N1TRENT) Adjusted Stock Prices
XNSE/INGERRAND,Ingersoll Rand (India) Ltd. (INGERRAND) Adjusted Stock Prices
XNSE/SAKUMA,Sakuma Exports Ltd. (SAKUMA) Adjusted Stock Prices
XNSE/PHOENIXLL,Phoenix Lamps Ltd (PHOENIXLL) Adjusted Stock Prices
XNSE/AICHAMP,AI Champdany Industries Ltd. (AICHAMP) Adjusted Stock Prices
XNSE/VINDHYATEL,Vindhya Telelinks Ltd. (VINDHYATEL) Adjusted Stock Prices
XNSE/DPL,Dhunseri Petrochem Ltd. (DPL) Adjusted Stock Prices
XNSE/BEL,Bharat Electronics Ltd. (BEL) Adjusted Stock Prices
XNSE/RPL,Reliance Petroleum Ltd. (RPL) Adjusted Stock Prices
XNSE/TANLA,Tanla Solutions Ltd. (TANLA) Adjusted Stock Prices
XNSE/OUDHSUG,Oudh Sugar Mills Ltd. (OUDHSUG) Adjusted Stock Prices
XNSE/BOMDYEING,Bombay Dyeing & Manufacturing Co. Ltd. (BOMDYEING) Adjusted Stock Prices
XNSE/GLOBOFFS,Global Offshore Services Ltd (GLOBOFFS) Adjusted Stock Prices
XNSE/CCHHL,Country Club Hospitality & Holidays Ltd. (CCHHL) Adjusted Stock Prices
XNSE/CURATECH,Cura Technologies Ltd (CURATECH) Adjusted Stock Prices
XNSE/IFBIND,IFB Industries Ltd. (IFBIND) Adjusted Stock Prices
XNSE/JVLAGRO,JVL Agro Industries Ltd (JVLAGRO) Adjusted Stock Prices
XNSE/LGBFORGE,LGB Forge Ltd. (LGBFORGE) Adjusted Stock Prices
XNSE/Y3SRTRANSFIN,Shriram Transport Finance Co. Ltd. (Y3SRTRANSFIN) Adjusted Stock Prices
XNSE/MINDAIND,Minda Industries Ltd. (MINDAIND) Adjusted Stock Prices
XNSE/NAVNETEDUL,Navneet Education Ltd (NAVNETEDUL) Adjusted Stock Prices
XNSE/SUNTECK,Sunteck Realty Ltd. (SUNTECK) Adjusted Stock Prices
XNSE/MFHSEP24M19G,HDFC Asset Management Company Ltd. (MFHSEP24M19G) Adjusted Stock Prices
XNSE/DENORA,De Nora India Ltd. (DENORA) Adjusted Stock Prices
XNSE/GEOJITBNPP,Geojit BNP Paribas Financial Services Ltd. (GEOJITBNPP) Adjusted Stock Prices
XNSE/PIDILITIND,Pidilite Industries Ltd. (PIDILITIND) Adjusted Stock Prices
XNSE/FEDERALBNK,Federal Bank Ltd. (FEDERALBNK) Adjusted Stock Prices
XNSE/DCW,DCW Ltd. (DCW) Adjusted Stock Prices
XNSE/ONMOBILE,OnMobile Global Ltd (ONMOBILE) Adjusted Stock Prices
XNSE/ASHOKLEY,Ashok Leyland Ltd. (ASHOKLEY) Adjusted Stock Prices
XNSE/RAJSREESUG,Rajshree Sugars & Chemicals Ltd. (RAJSREESUG) Adjusted Stock Prices
XNSE/TALBROAUTO,Talbros Automotive Components Ltd. (TALBROAUTO) Adjusted Stock Prices
XNSE/GKWLIMITED,GKW Ltd. (GKWLIMITED) Adjusted Stock Prices
XNSE/ACE,Action Construction Equipment Ltd. (ACE) Adjusted Stock Prices
XNSE/W1RJL,Renaissance Jewellery Ltd. (W1RJL) Adjusted Stock Prices
XNSE/MFIPRU1830,ICICI Prudential Asset Management Company Ltd. (MFIPRU1830) Adjusted Stock Prices
XNSE/CLUTCHAUTO,Clutch Auto Ltd. (CLUTCHAUTO) Adjusted Stock Prices
XNSE/ABBOTINDIA,Abbott India Ltd. (ABBOTINDIA) Adjusted Stock Prices
XNSE/SHEMAROO,Shemaroo Entertainment Ltd. (SHEMAROO) Adjusted Stock Prices
XNSE/KOTHARIPET,Kothari Petrochemicals Ltd. (KOTHARIPET) Adjusted Stock Prices
XNSE/SASKEN,Sasken Technologies Ltd. (SASKEN) Adjusted Stock Prices
XNSE/JKTYRE,JK Tyre & Industries Ltd. (JKTYRE) Adjusted Stock Prices
XNSE/ADANIPOWER,Adani Power Limited (ADANIPOWER) Adjusted Stock Prices
XNSE/LUMAXIND,Lumax Industries Ltd. (LUMAXIND) Adjusted Stock Prices
XNSE/UPERGANGES,Upper Ganges Sugar & Industries Ltd. (UPERGANGES) Adjusted Stock Prices
XNSE/N4TCFSL,Tata Capital Financial Services Limited (N4TCFSL) Adjusted Stock Prices
XNSE/ALSTOMT_D,GE T&D India Ltd. (ALSTOMT_D) Adjusted Stock Prices
XNSE/INDOTECH,Indo Tech Transformers Ltd. (INDOTECH) Adjusted Stock Prices
XNSE/INFRATEL,Bharti Infratel Ltd (INFRATEL) Adjusted Stock Prices
XNSE/MFBSLCP2G,Birla Sun Life Asset Management Company Ltd (MFBSLCP2G) Adjusted Stock Prices
XNSE/ZEELEARN,Zee Learn Ltd (ZEELEARN) Adjusted Stock Prices
XNSE/INDRAMEDCO,Indraprastha Medical Corporation Ltd. (INDRAMEDCO) Adjusted Stock Prices
XNSE/MFSMCSRVIRG,Sundaram Asset Management Company Limited (MFSMCSRVIRG) Adjusted Stock Prices
XNSE/METKORE,Metkore Alloys & Industries Ltd (METKORE) Adjusted Stock Prices
XNSE/AMARJOTHI,Amarjothi Spinning Mills Ltd.
XNSE/GARDENSILK,Garden Silk Mills Ltd. (GARDENSILK) Adjusted Stock Prices
XNSE/LOTUSEYE,Lotus Eye Hospital and Institute Ltd (LOTUSEYE) Adjusted Stock Prices
XNSE/GREENFIRE,Proseed India Ltd. (GREENFIRE) Adjusted Stock Prices
XNSE/BHAGYNAGAR,Bhagyanagar India Ltd. (BHAGYNAGAR) Adjusted Stock Prices
XNSE/EASUNREYRL,Easun Reyrolle Ltd. (EASUNREYRL) Adjusted Stock Prices
XNSE/WEIZMANIND,Weizmann Ltd. (WEIZMANIND) Adjusted Stock Prices
XNSE/VARDHACRLC,Vardhman Acrylics Ltd. (VARDHACRLC) Adjusted Stock Prices
XNSE/NESTLEIND,Nestle India Ltd. (NESTLEIND) Adjusted Stock Prices
XNSE/CAREERP,Career Point Ltd (CAREERP) Adjusted Stock Prices
XNSE/TIMKEN,Timken India Ltd. (TIMKEN) Adjusted Stock Prices
XNSE/JMFINANCIL,JM Financial Ltd. (JMFINANCIL) Adjusted Stock Prices
XNSE/DREDGECORP,Dredging Corporation of India Ltd. (DREDGECORP) Adjusted Stock Prices
XNSE/PRABHAT,Prabhat Dairy Ltd. (PRABHAT) Adjusted Stock Prices
XNSE/N4L_TFINANCE,L&T Finance Limited. (N4L.TFINANCE) Adjusted Stock Prices
XNSE/TFCILTD,Tourism Finance Corporation of India Ltd. (TFCILTD) Adjusted Stock Prices
XNSE/W1IBULHSGFIN,Indiabulls Housing Finance Limited (W1IBULHSGFIN) Adjusted Stock Prices
XNSE/MFFTFTF14BDV,Franklin Templeton Asset Management (India) Private Limited (MFFTFTF14BDV) Adjusted Stock Prices
XNSE/IDFC,IDFC Ltd (IDFC) Adjusted Stock Prices
XNSE/TRIVENI,Triveni Engineering & Industries Ltd. (TRIVENI) Adjusted Stock Prices
XNSE/JINDALSAW,Jindal SAW Ltd. (JINDALSAW) Adjusted Stock Prices
XNSE/IGOLD,ICICI Prudential Asset Management Company Ltd. (IGOLD) Adjusted Stock Prices
XNSE/BAJAJ_AUTO,Bajaj Auto Ltd (BAJAJ_AUTO) Adjusted Stock Prices
XNSE/TBZ,Tribhovandas Bhimji Zaveri Ltd (TBZ) Adjusted Stock Prices
XNSE/GALLISPAT,Gallantt Ispat Ltd (GALLISPAT) Adjusted Stock Prices
XNSE/PONNIERODE,Ponni Sugars (Erode) Ltd. (PONNIERODE) Adjusted Stock Prices
XNSE/POLYPLEX,Polyplex Corporation Ltd. (POLYPLEX) Adjusted Stock Prices
XNSE/JISLDVREQS,Jain Irrigation Systems Ltd. (JISLDVREQS) Adjusted Stock Prices
XNSE/USHAMART,Usha Martin Ltd. (USHAMART) Adjusted Stock Prices
XNSE/ENGINERSIN,Engineers India Ltd. (ENGINERSIN) Adjusted Stock Prices
XNSE/JETAIRWAYS,Jet Airways India (JETAIRWAYS) Adjusted Stock Prices
XNSE/DEN,Den Networks Limited (DEN) Adjusted Stock Prices
XNSE/CASTROLIND,Castrol (India) Ltd. (CASTROLIND) Adjusted Stock Prices
XNSE/RESPONIND,Responsive Industries Ltd (RESPONIND) Adjusted Stock Prices
XNSE/BLUEDART,Blue Dart Express Ltd. (BLUEDART) Adjusted Stock Prices
XNSE/SAMBHAAV,Sambhaav Media Ltd. (SAMBHAAV) Adjusted Stock Prices
XNSE/IZMO,izmo Ltd. (IZMO) Adjusted Stock Prices
XNSE/GODREJPROP,Godrej Properties Limited (GODREJPROP) Adjusted Stock Prices
XNSE/AXISBANK,Axis Bank Ltd (AXISBANK) Adjusted Stock Prices
XNSE/ANSALAPI,Ansal Properties & Infrastructure Ltd. (ANSALAPI) Adjusted Stock Prices
XNSE/MCDOWELL_N,United Spirits Ltd. (MCDOWELL_N) Adjusted Stock Prices
XNSE/ZENITHEXPO,Zenith Exports Ltd. (ZENITHEXPO) Adjusted Stock Prices
XNSE/N6IDFC,IDFC Ltd (N6IDFC) Adjusted Stock Prices
XNSE/N3TCFSL,Tata Capital Financial Services Limited (N3TCFSL) Adjusted Stock Prices
XNSE/DRSTAN,Standard Chartered plc
XNSE/SURYAJYOTI,Suryajyoti Spinning Mills Ltd. (SURYAJYOTI) Adjusted Stock Prices
XNSE/FELDVR,Future Enterprises Ltd. (FELDVR) Adjusted Stock Prices
XNSE/JSWSTEEL,JSW Steel Ltd. (JSWSTEEL) Adjusted Stock Prices
XNSE/ICICIBANK,ICICI Bank Ltd. (ICICIBANK) Adjusted Stock Prices
XNSE/MRPL,Mangalore Refinery & Petrochemicals Ltd. (MRPL) Adjusted Stock Prices
XNSE/GUJAPOLLO,Gujarat Apollo Industries Ltd. (GUJAPOLLO) Adjusted Stock Prices
XNSE/RAMKY,Ramky Infrastructure Ltd (RAMKY) Adjusted Stock Prices
XNSE/E1IBN18,TV18 Broadcast Ltd (E1IBN18) Adjusted Stock Prices
XNSE/ASIANHOTNR,Asian Hotels (North) Ltd. (ASIANHOTNR) Adjusted Stock Prices
XNSE/JIKIND,JIK Industries Ltd. (JIKIND) Adjusted Stock Prices
XNSE/BALMLAWRIE,Balmer Lawrie & Co. Ltd. (BALMLAWRIE) Adjusted Stock Prices
XNSE/HESTERBIO,Hester Biosciences Ltd (HESTERBIO) Adjusted Stock Prices
XNSE/SUMMITSEC,Summit Securities Ltd (SUMMITSEC) Adjusted Stock Prices
XNSE/SAYAJIHOTL,Sayaji Hotels Ltd. (SAYAJIHOTL) Adjusted Stock Prices
XNSE/KGL,Karuturi Global Ltd (KGL) Adjusted Stock Prices
XNSE/EXIDEIND,Exide Industries Ltd. (EXIDEIND) Adjusted Stock Prices
XNSE/WSTCSTPAPR,West Coast Paper Mills Ltd. (WSTCSTPAPR) Adjusted Stock Prices
XNSE/PFOCUS,Prime Focus Ltd. (PFOCUS) Adjusted Stock Prices
XNSE/P1MUKANDLTD,Mukand Ltd. (P1MUKANDLTD) Adjusted Stock Prices
XNSE/SELAN,Selan Exploration Technology Ltd. (SELAN) Adjusted Stock Prices
XNSE/ASHCONIUL,Ashco Niulab Industries Ltd
XNSE/THANGAMAYL,Thangamayil Jewellery Limited (THANGAMAYL) Adjusted Stock Prices
XNSE/POCHIRAJU,Pochiraju Industries Ltd. (POCHIRAJU) Adjusted Stock Prices
XNSE/MFRFHFXX33GP,Reliance Capital Asset Management Ltd (MFRFHFXX33GP) Adjusted Stock Prices
XNSE/AARVEEDEN,Aarvee Denims & Exports Ltd (AARVEEDEN) Adjusted Stock Prices
XNSE/JKPAPER,JK Paper Ltd (JKPAPER) Adjusted Stock Prices
XNSE/RELGRNIFTY,Invesco Asset Management (India) Pvt. Ltd. (RELGRNIFTY) Adjusted Stock Prices
XNSE/MANPASAND,Manpasand Beverages Ltd (MANPASAND) Adjusted Stock Prices
XNSE/INDIANHUME,Indian Hume Pipe Co. Ltd. (INDIANHUME) Adjusted Stock Prices
XNSE/M_M,Mahindra & Mahindra Ltd. (M_M) Adjusted Stock Prices
XNSE/LITL,Lanco Infratech Ltd. (LITL) Adjusted Stock Prices
XNSE/VISUALSOFT,Visualsoft Technologies Ltd. (VISUALSOFT) Adjusted Stock Prices
XNSE/N7MUTHOOTFIN,Muthoot Finance Ltd. (N7MUTHOOTFIN) Adjusted Stock Prices
XNSE/ASHIANA,Ashiana Housing Ltd. (ASHIANA) Adjusted Stock Prices
XNSE/BEML,BEML Ltd. (BEML) Adjusted Stock Prices
XNSE/GPPL,Gujarat Pipavav Port Ltd (GPPL) Adjusted Stock Prices
XNSE/SKIL,SKIL Infrastructure Ltd. (SKIL) Adjusted Stock Prices
XNSE/ZODIACLOTH,Zodiac Clothing Co. Ltd. (ZODIACLOTH) Adjusted Stock Prices
XNSE/N1DRREDDY,Dr. Reddy`s Laboratories Ltd. (N1DRREDDY) Adjusted Stock Prices
XNSE/CREATIVEYE,Creative Eye Ltd. (CREATIVEYE) Adjusted Stock Prices
XNSE/DLF,DLF Ltd. (DLF) Adjusted Stock Prices
XNSE/CYIENT,Cyient Ltd. (CYIENT) Adjusted Stock Prices
XNSE/CEREBRAINT,Cerebra Integrated Technologies Ltd. (CEREBRAINT) Adjusted Stock Prices
XNSE/JAIHINDPRO,Jaihind Projects Ltd. (JAIHINDPRO) Adjusted Stock Prices
XNSE/NTPC,NTPC Ltd. (NTPC) Adjusted Stock Prices
XNSE/N1SBIN,State Bank of India (N1SBIN) Adjusted Stock Prices
XNSE/N2NHAI,National Highways Authority of India (N2NHAI) Adjusted Stock Prices
XNSE/TATASTEEL,Tata Steel Ltd. (TATASTEEL) Adjusted Stock Prices
XNSE/KANANIIND,Kanani Industries Ltd. (KANANIIND) Adjusted Stock Prices
XNSE/BROADCAST,Broadcast Initiatives Ltd. (BROADCAST) Adjusted Stock Prices
XNSE/KITEX,Kitex Garments Ltd. (KITEX) Adjusted Stock Prices
XNSE/WEBELSOLAR,Websol Energy System Ltd (WEBELSOLAR) Adjusted Stock Prices
XNSE/KEYCORPSER,Keynote Corporate Services Ltd. (KEYCORPSER) Adjusted Stock Prices
XNSE/SALSTEEL,SAL Steel Ltd (SALSTEEL) Adjusted Stock Prices
XNSE/JMTAUTOLTD,JMT Auto Ltd. (JMTAUTOLTD) Adjusted Stock Prices
XNSE/VIMALOIL,Vimal Oil & Foods Ltd. (VIMALOIL) Adjusted Stock Prices
XNSE/RAMCOIND,Ramco Industries Ltd. (RAMCOIND) Adjusted Stock Prices
XNSE/MFRDAFTIIPAG,Reliance Capital Asset Management Ltd (MFRDAFTIIPAG) Adjusted Stock Prices
XNSE/KLGSYSTEL,KLG Systel Ltd.
XNSE/N1TATACOFFEE,Tata Coffee Ltd. (N1TATACOFFEE) Adjusted Stock Prices
XNSE/LFIC,Lakshmi Finance & Industrial Corporation Ltd (LFIC) Adjusted Stock Prices
XNSE/KSE,KSE Ltd.
XNSE/SOFTTECHGR,STG Lifecare Ltd (SOFTTECHGR) Adjusted Stock Prices
XNSE/KAMATHOTEL,Kamat Hotels (India) Ltd (KAMATHOTEL) Adjusted Stock Prices
XNSE/CAIRN,Cairn India Ltd. (CAIRN) Adjusted Stock Prices
XNSE/LAKSHMIEFL,Lakshmi Energy and Foods Ltd (LAKSHMIEFL) Adjusted Stock Prices
XNSE/8KMILES,8K Miles Software Services Ltd (8KMILES) Adjusted Stock Prices
XNSE/VINYLINDIA,Vinyl Chemicals (India) Ltd. (VINYLINDIA) Adjusted Stock Prices
XNSE/TAJGVK,Taj GVK Hotels & Resorts Ltd. (TAJGVK) Adjusted Stock Prices
XNSE/SIMPLEXINF,Simplex Infrastructure Ltd (SIMPLEXINF) Adjusted Stock Prices
XNSE/APOLLOHOSP,Apollo Hospitals Enterprises Ltd. (APOLLOHOSP) Adjusted Stock Prices
XNSE/MFFTFTF13AGR,Franklin Templeton Asset Management (India) Private Limited (MFFTFTF13AGR) Adjusted Stock Prices
XNSE/DICIND,DIC India Ltd. (DICIND) Adjusted Stock Prices
XNSE/APLLTD,Alembic Pharmaceuticals Ltd (APLLTD) Adjusted Stock Prices
XNSE/N3IDFC,IDFC Ltd (N3IDFC) Adjusted Stock Prices
XNSE/GEMINI,Gemini Communications Ltd. (GEMINI) Adjusted Stock Prices
XNSE/TIL,TIL Ltd. (TIL) Adjusted Stock Prices
XNSE/N5IDFC,IDFC Ltd (N5IDFC) Adjusted Stock Prices
XNSE/COX_KINGS,Cox and Kings Ltd. (COX_KINGS) Adjusted Stock Prices
XNSE/BAJAJHLDNG,Bajaj Holdings & Investment Ltd (BAJAJHLDNG) Adjusted Stock Prices
XNSE/KIRLOSIND,Kirloskar Industries Ltd. (KIRLOSIND) Adjusted Stock Prices
XNSE/PATINTLOG,Patel Integrated Logistics Ltd. (PATINTLOG) Adjusted Stock Prices
XNSE/TWILITAKA,Twilight Litaka Pharmaceuticals Ltd.
XNSE/JAYPEEHOT,Jaypee Hotels Ltd. (JAYPEEHOT) Adjusted Stock Prices
XNSE/NNSRTRANSFIN,Shriram Transport Finance Co. Ltd. (NNSRTRANSFIN) Adjusted Stock Prices
XNSE/N8SREINFRA,SREI Infrastructure Finance Ltd. (N8SREINFRA) Adjusted Stock Prices
XNSE/ALMONDZ,Almondz Global Securities Ltd (ALMONDZ) Adjusted Stock Prices
XNSE/GUJFLUORO,Gujarat Fluorochemicals Ltd. (GUJFLUORO) Adjusted Stock Prices
XNSE/NESCO,NESCO Ltd. (NESCO) Adjusted Stock Prices
XNSE/AARTIIND,Aarti Industries Ltd. (AARTIIND) Adjusted Stock Prices
XNSE/NMDC,NMDC Ltd. (NMDC) Adjusted Stock Prices
XNSE/SGFL,Shree Ganesh Forgings Ltd. (SGFL) Adjusted Stock Prices
XNSE/HITACHIHOM,Hitachi Home & Life Solutions (India) Ltd. (HITACHIHOM) Adjusted Stock Prices
XNSE/CINEMAXIN,Cinemax India Ltd (CINEMAXIN) Adjusted Stock Prices
XNSE/OFSS,Oracle Financial Services Software Ltd (OFSS) Adjusted Stock Prices
XNSE/NHSRTRANSFIN,Shriram Transport Finance Co. Ltd. (NHSRTRANSFIN) Adjusted Stock Prices
XNSE/FCEL,Future Consumer Enterprise Ltd. (FCEL) Adjusted Stock Prices
XNSE/ZYLOG,Zylog Systems Ltd. (ZYLOG) Adjusted Stock Prices
XNSE/WHIRLPOOL,Whirlpool of India Ltd. (WHIRLPOOL) Adjusted Stock Prices
XNSE/P1SAKUMA,Sakuma Exports Ltd.
XNSE/GITANJALI,Gitanjali Gems Ltd. (GITANJALI) Adjusted Stock Prices
XNSE/BHARATFORG,Bharat Forge Ltd. (BHARATFORG) Adjusted Stock Prices
XNSE/BEDMUTHA,Bedmutha Industries Ltd (BEDMUTHA) Adjusted Stock Prices
XNSE/DEEPAKNTR,Deepak Nitrite Ltd. (DEEPAKNTR) Adjusted Stock Prices
XNSE/PSUBNKBEES,Goldman Sachs Asset Management (India) Pvt. Ltd. (PSUBNKBEES) Adjusted Stock Prices
XNSE/STEELTUBES,Steel Tubes of India Ltd. (STEELTUBES) Adjusted Stock Prices
XNSE/APLAPOLLO,APL Apollo Tubes Ltd. (APLAPOLLO) Adjusted Stock Prices
XNSE/ECLERX,eClerx Services Ltd. (ECLERX) Adjusted Stock Prices
XNSE/BLISSGVS,Bliss GVS Pharma Ltd. (BLISSGVS) Adjusted Stock Prices
XNSE/NRSRTRANSFIN,Shriram Transport Finance Co. Ltd. (NRSRTRANSFIN) Adjusted Stock Prices
XNSE/ALLSEC,Allsec Technologies Ltd. (ALLSEC) Adjusted Stock Prices
XNSE/SHILPI,Shilpi Cable Technologies Ltd (SHILPI) Adjusted Stock Prices
XNSE/LEEL,LEEL Electricals Ltd (LEEL) Adjusted Stock Prices
XNSE/INDIACEM,India Cements Ltd. (INDIACEM) Adjusted Stock Prices
XNSE/NITINFIRE,Nitin Fire Protection Industries Ltd. (NITINFIRE) Adjusted Stock Prices
XNSE/SMSPHARMA,SMS Pharmaceuticals Ltd. (SMSPHARMA) Adjusted Stock Prices
XNSE/FCSSOFT,FCS Software Solutions Ltd. (FCSSOFT) Adjusted Stock Prices
XNSE/ABB,ABB India Ltd (ABB) Adjusted Stock Prices
XNSE/SUNTV,Sun TV Network Ltd. (SUNTV) Adjusted Stock Prices
XNSE/MFDWSHYD7GR,Deutsche Asset Management (India) Pvt Ltd (MFDWSHYD7GR) Adjusted Stock Prices
XNSE/INDTERRAIN,Indian Terrain Fashions Ltd. (INDTERRAIN) Adjusted Stock Prices
XNSE/BLOWPLAST,Blow Plast Ltd. (BLOWPLAST) Adjusted Stock Prices
XNSE/INDNIPPON,India Nippon Electricals Ltd. (INDNIPPON) Adjusted Stock Prices
XNSE/JBFIND,JBF Industries Ltd. (JBFIND) Adjusted Stock Prices
XNSE/OSWALMIN,Oswal Minerals Ltd (OSWALMIN) Adjusted Stock Prices
XNSE/MFDWSFMP71RG,Deutsche Asset Management (India) Pvt Ltd (MFDWSFMP71RG) Adjusted Stock Prices
XNSE/INVENTURE,Inventure Growth and Securities Ltd (INVENTURE) Adjusted Stock Prices
XNSE/RANASUG,Rana Sugars Ltd. (RANASUG) Adjusted Stock Prices
XNSE/SB_TINTL,S.B.& T. International Ltd.
XNSE/ANDHRSUGAR,Andhra Sugars Ltd. (ANDHRSUGAR) Adjusted Stock Prices
XNSE/AXISGOLD,Axis Asset Management Company Limited (AXISGOLD) Adjusted Stock Prices
XNSE/MFRDAFTIIIDG,Reliance Nippon Life Asset Management Ltd. (MFRDAFTIIIDG) Adjusted Stock Prices
XNSE/VMART,V-Mart Retail Ltd (VMART) Adjusted Stock Prices
XNSE/AGCNET,AGC Networks Ltd. (AGCNET) Adjusted Stock Prices
XNSE/SILINV,SIL Investments Ltd. (SILINV) Adjusted Stock Prices
XNSE/PALREDTECH,Palred Technologies Ltd. (PALREDTECH) Adjusted Stock Prices
XNSE/SIGNET,Signet Industries Ltd. (SIGNET) Adjusted Stock Prices
XNSE/CPSEETF,Goldman Sachs Asset Management (India) Pvt. Ltd. (CPSEETF) Adjusted Stock Prices
XNSE/3MINDIA,3M India Ltd. (3MINDIA) Adjusted Stock Prices
XNSE/HINDALCO,Hindalco Industries Ltd. (HINDALCO) Adjusted Stock Prices
XNSE/MFBSLRGES1RG,Birla Sun Life Asset Management Company Ltd (MFBSLRGES1RG) Adjusted Stock Prices
XNSE/ROLTA,Rolta India Ltd. (ROLTA) Adjusted Stock Prices
XNSE/KIL,Kamdhenu Ltd. (KIL) Adjusted Stock Prices
XNSE/W1BAJAUTOFIN,Bajaj Finance Ltd (W1BAJAUTOFIN) Adjusted Stock Prices
XNSE/MFJ502G,JP Morgan Asset Management India Pvt Ltd (MFJ502G) Adjusted Stock Prices
XNSE/VICEROY,Viceroy Hotels Ltd. (VICEROY) Adjusted Stock Prices
XNSE/NATIONALUM,National Aluminium Co. Ltd. (NATIONALUM) Adjusted Stock Prices
XNSE/NAKODA,Nakoda Ltd. (NAKODA) Adjusted Stock Prices
XNSE/FKONCO,Fresenius Kabi Oncology Ltd (FKONCO) Adjusted Stock Prices
XNSE/EMMBI,Emmbi Industries Ltd (EMMBI) Adjusted Stock Prices
XNSE/KRISHNAENG,Krishna Engineering Works Ltd. (KRISHNAENG) Adjusted Stock Prices
XNSE/JAINSTUDIO,Jain Studios Ltd. (JAINSTUDIO) Adjusted Stock Prices
XNSE/NBIIFLFIN,India Infoline Finance Ltd (NBIIFLFIN) Adjusted Stock Prices
XNSE/TIMESGTY,Times Guaranty Ltd. (TIMESGTY) Adjusted Stock Prices
XNSE/VOLTAS,Voltas Ltd. (VOLTAS) Adjusted Stock Prices
XNSE/BODALCHEM,Bodal Chemicals Ltd. (BODALCHEM) Adjusted Stock Prices
XNSE/DHAMPURSUG,Dhampur Sugar Mills Ltd (DHAMPURSUG) Adjusted Stock Prices
XNSE/GAIL,Gail (India) Ltd. (GAIL) Adjusted Stock Prices
XNSE/STEL,STEL Holdings Ltd (STEL) Adjusted Stock Prices
XNSE/MFUFTFGR16P7,UTI Asset Management Company Ltd (MFUFTFGR16P7) Adjusted Stock Prices
XNSE/N1ICIBK1107,ICICI Bank Ltd. (N1ICIBK1107) Adjusted Stock Prices
XNSE/UTINIFTETF,UTI Asset Management Company Ltd (UTINIFTETF) Adjusted Stock Prices
XNSE/AUTOIND,Autoline Industries Ltd. (AUTOIND) Adjusted Stock Prices
XNSE/RUBYMILLS,Ruby Mills Ltd. (RUBYMILLS) Adjusted Stock Prices
XNSE/ELDERPHARM,Elder Pharmaceuticals Ltd. (ELDERPHARM) Adjusted Stock Prices
XNSE/UTISENSETF,UTI Asset Management Company Ltd (UTISENSETF) Adjusted Stock Prices
XNSE/SMOPAL,Opal Luxury Time Products Ltd (SMOPAL) Adjusted Stock Prices
XNSE/MFRELDUALGPA,Reliance Capital Asset Management Ltd (MFRELDUALGPA) Adjusted Stock Prices
XNSE/GLORY,Glory Films Ltd (GLORY) Adjusted Stock Prices
XNSE/BLUEBLENDS,Blue Blends (India) Ltd. (BLUEBLENDS) Adjusted Stock Prices
XNSE/CGCL,Capri Global Capital Ltd (CGCL) Adjusted Stock Prices
XNSE/N4SRTRANSFIN,Shriram Transport Finance Co. Ltd. (N4SRTRANSFIN) Adjusted Stock Prices
XNSE/KALINDEE,Kalindee Rail Nirman (Engineers) Ltd. (KALINDEE) Adjusted Stock Prices
XNSE/MERCATOR,Mercator Ltd (MERCATOR) Adjusted Stock Prices
XNSE/BGLOBAL,Bharatiya Global Infomedia Ltd (BGLOBAL) Adjusted Stock Prices
XNSE/AXISCADES,AXISCADES Engineering Technologies Ltd (AXISCADES) Adjusted Stock Prices
XNSE/ERAINFRA,Era Infra Engineering Ltd. (ERAINFRA) Adjusted Stock Prices
XNSE/UMESLTD,Usha Martin Education & Solutions Ltd (UMESLTD) Adjusted Stock Prices
XNSE/INDIANB,Indian Bank (INDIANB) Adjusted Stock Prices
XNSE/SPECTACLE,Spectacle Ventures Ltd (SPECTACLE) Adjusted Stock Prices
XNSE/TATACHEM,Tata Chemicals Ltd. (TATACHEM) Adjusted Stock Prices
XNSE/JPASSOCIAT,Jaiprakash Associates Ltd. (JPASSOCIAT) Adjusted Stock Prices
XNSE/SPYL,Shekhawati Poly-Yarn Limited (SPYL) Adjusted Stock Prices
XNSE/TIIL,Technocraft Industries (India) Ltd. (TIIL) Adjusted Stock Prices
XNSE/N1IIFLFIN,India Infoline Finance Ltd (N1IIFLFIN) Adjusted Stock Prices
XNSE/MAX,Max Financial Services Ltd. (MAX) Adjusted Stock Prices
XNSE/ATULAUTO,Atul Auto Ltd. (ATULAUTO) Adjusted Stock Prices
XNSE/SHASUNPHAR,Shasun Pharmaceuticals Ltd
XNSE/ZEEL,Zee Entertainment Enterprises Ltd (ZEEL) Adjusted Stock Prices
XNSE/MANAKALUCO,Manaksia Aluminium Co. Ltd. (MANAKALUCO) Adjusted Stock Prices
XNSE/HOVS,HOV Services Ltd. (HOVS) Adjusted Stock Prices
XNSE/SUNPHARMA,Sun Pharmaceutical Industries Ltd. (SUNPHARMA) Adjusted Stock Prices
XNSE/BURNPUR,Burnpur Cement Ltd. (BURNPUR) Adjusted Stock Prices
XNSE/PDUMJEPULP,Pudumjee Pulp & Paper Mills Ltd. (PDUMJEPULP) Adjusted Stock Prices
XNSE/SOBHA,Sobha Ltd. (SOBHA) Adjusted Stock Prices
XNSE/ASHAPURMIN,Ashapura Minechem Ltd. (ASHAPURMIN) Adjusted Stock Prices
XNSE/GREAVESCOT,Greaves Cotton Ltd. (GREAVESCOT) Adjusted Stock Prices
XNSE/SOLARINDS,Solar Industries India Ltd (SOLARINDS) Adjusted Stock Prices
XNSE/AFL,Accel Frontline Ltd. (AFL) Adjusted Stock Prices
XNSE/UPL,UPL Ltd (UPL) Adjusted Stock Prices
XNSE/CELEBRITY,Celebrity Fashions Ltd. (CELEBRITY) Adjusted Stock Prices
XNSE/NBVENTURES,Nava Bharat Ventures Ltd. (NBVENTURES) Adjusted Stock Prices
XNSE/CUB,City Union Bank Ltd. (CUB) Adjusted Stock Prices
XNSE/DHANBANK,Dhanlaxmi Bank Ltd. (DHANBANK) Adjusted Stock Prices
XNSE/KANORICHEM,Kanoria Chemicals & Industries Ltd. (KANORICHEM) Adjusted Stock Prices
XNSE/ZENITHINFO,Zenith Infotech Ltd.
XNSE/SHIRPUR_G,Shirpur Gold Refinery Ltd. (SHIRPUR_G) Adjusted Stock Prices
XNSE/TECHM,Tech Mahindra Ltd. (TECHM) Adjusted Stock Prices
XNSE/PRISMCEM,Prism Cement Ltd. (PRISMCEM) Adjusted Stock Prices
XNSE/FIRSTWIN,First Winner Industries Ltd (FIRSTWIN) Adjusted Stock Prices
XNSE/IOLCP,IOL Chemicals & Pharmaceuticals Ltd. (IOLCP) Adjusted Stock Prices
XNSE/GREENPOWER,Orient Green Power Company Limited (GREENPOWER) Adjusted Stock Prices
XNSE/APLAB,Aplab Ltd.
XNSE/PIRPHYTO,Piramal Phytocare Ltd (PIRPHYTO) Adjusted Stock Prices
XNSE/JINDRILL,Jindal Drilling & Industries Ltd. (JINDRILL) Adjusted Stock Prices
XNSE/MASTEK,Mastek Ltd. (MASTEK) Adjusted Stock Prices
XNSE/SDBL,Som Distilleries & Breweries Ltd. (SDBL) Adjusted Stock Prices
XNSE/RELDIVOPP,Reliance Nippon Life Asset Management Ltd. (RELDIVOPP) Adjusted Stock Prices
XNSE/ORIENTREF,Orient Refractories Ltd (ORIENTREF) Adjusted Stock Prices
XNSE/MFFTFTF15GR,Franklin Templeton Asset Management (India) Private Limited (MFFTFTF15GR) Adjusted Stock Prices
XNSE/N2SBIN,State Bank of India (N2SBIN) Adjusted Stock Prices
XNSE/LUPIN,Lupin Ltd (LUPIN) Adjusted Stock Prices
XNSE/ALKYLAMINE,Alkyl Amines Chemicals Ltd. (ALKYLAMINE) Adjusted Stock Prices
XNSE/MFIIFLFMPS1G,India Infoline Asset Management Co. Ltd (MFIIFLFMPS1G) Adjusted Stock Prices
XNSE/HYDROS_S,Hydro S&S Industries Ltd.
