XNSE/JBFIND_UADJ,JBF Industries Ltd. (JBFIND) Unadjusted Stock Prices
XNSE/INDNIPPON_UADJ,India Nippon Electricals Ltd. (INDNIPPON) Unadjusted Stock Prices
XNSE/MFDWSFMP71RG_UADJ,Deutsche Asset Management (India) Pvt Ltd (MFDWSFMP71RG) Unadjusted Stock Prices
XNSE/RANASUG_UADJ,Rana Sugars Ltd. (RANASUG) Unadjusted Stock Prices
XNSE/MFRDAFTIIIDG_UADJ,Reliance Nippon Life Asset Management Ltd. (MFRDAFTIIIDG) Unadjusted Stock Prices
XNSE/SIGNET_UADJ,Signet Industries Ltd. (SIGNET) Unadjusted Stock Prices
XNSE/SB_TINTL_UADJ,S.B.& T. International Ltd. (SB.TINTL) Unadjusted Stock Prices
XNSE/AXISGOLD_UADJ,Axis Asset Management Company Limited (AXISGOLD) Unadjusted Stock Prices
XNSE/VMART_UADJ,V-Mart Retail Ltd (VMART) Unadjusted Stock Prices
XNSE/INVENTURE_UADJ,Inventure Growth and Securities Ltd (INVENTURE) Unadjusted Stock Prices
XNSE/CPSEETF_UADJ,Goldman Sachs Asset Management (India) Pvt. Ltd. (CPSEETF) Unadjusted Stock Prices
XNSE/OSWALMIN_UADJ,Oswal Minerals Ltd (OSWALMIN) Unadjusted Stock Prices
XNSE/BLOWPLAST_UADJ,Blow Plast Ltd. (BLOWPLAST) Unadjusted Stock Prices
XNSE/SILINV_UADJ,SIL Investments Ltd. (SILINV) Unadjusted Stock Prices
XNSE/HINDALCO_UADJ,Hindalco Industries Ltd. (HINDALCO) Unadjusted Stock Prices
XNSE/KIL_UADJ,Kamdhenu Ltd. (KIL) Unadjusted Stock Prices
XNSE/ANDHRSUGAR_UADJ,Andhra Sugars Ltd. (ANDHRSUGAR) Unadjusted Stock Prices
XNSE/3MINDIA_UADJ,3M India Ltd. (3MINDIA) Unadjusted Stock Prices
XNSE/AGCNET_UADJ,AGC Networks Ltd. (AGCNET) Unadjusted Stock Prices
XNSE/ROLTA_UADJ,Rolta India Ltd. (ROLTA) Unadjusted Stock Prices
XNSE/MFJ502G_UADJ,JP Morgan Asset Management India Pvt Ltd (MFJ502G) Unadjusted Stock Prices
XNSE/MFBSLRGES1RG_UADJ,Birla Sun Life Asset Management Company Ltd (MFBSLRGES1RG) Unadjusted Stock Prices
XNSE/PALREDTECH_UADJ,Palred Technologies Ltd. (PALREDTECH) Unadjusted Stock Prices
XNSE/W1BAJAUTOFIN_UADJ,Bajaj Finance Ltd (W1BAJAUTOFIN) Unadjusted Stock Prices
XNSE/VICEROY_UADJ,Viceroy Hotels Ltd. (VICEROY) Unadjusted Stock Prices
XNSE/NATIONALUM_UADJ,National Aluminium Co. Ltd. (NATIONALUM) Unadjusted Stock Prices
XNSE/EMMBI_UADJ,Emmbi Industries Ltd (EMMBI) Unadjusted Stock Prices
XNSE/FKONCO_UADJ,Fresenius Kabi Oncology Ltd (FKONCO) Unadjusted Stock Prices
XNSE/KRISHNAENG_UADJ,Krishna Engineering Works Ltd. (KRISHNAENG) Unadjusted Stock Prices
XNSE/NAKODA_UADJ,Nakoda Ltd. (NAKODA) Unadjusted Stock Prices
XNSE/JAINSTUDIO_UADJ,Jain Studios Ltd. (JAINSTUDIO) Unadjusted Stock Prices
XNSE/NBIIFLFIN_UADJ,India Infoline Finance Ltd (NBIIFLFIN) Unadjusted Stock Prices
XNSE/TIMESGTY_UADJ,Times Guaranty Ltd. (TIMESGTY) Unadjusted Stock Prices
XNSE/GAIL_UADJ,Gail (India) Ltd. (GAIL) Unadjusted Stock Prices
XNSE/VOLTAS_UADJ,Voltas Ltd. (VOLTAS) Unadjusted Stock Prices
XNSE/DHAMPURSUG_UADJ,Dhampur Sugar Mills Ltd (DHAMPURSUG) Unadjusted Stock Prices
XNSE/BODALCHEM_UADJ,Bodal Chemicals Ltd. (BODALCHEM) Unadjusted Stock Prices
XNSE/MFUFTFGR16P7_UADJ,UTI Asset Management Company Ltd (MFUFTFGR16P7) Unadjusted Stock Prices
XNSE/STEL_UADJ,STEL Holdings Ltd (STEL) Unadjusted Stock Prices
XNSE/N1ICIBK1107_UADJ,ICICI Bank Ltd. (N1ICIBK1107) Unadjusted Stock Prices
XNSE/RUBYMILLS_UADJ,Ruby Mills Ltd. (RUBYMILLS) Unadjusted Stock Prices
XNSE/AUTOIND_UADJ,Autoline Industries Ltd. (AUTOIND) Unadjusted Stock Prices
XNSE/ELDERPHARM_UADJ,Elder Pharmaceuticals Ltd. (ELDERPHARM) Unadjusted Stock Prices
XNSE/UTISENSETF_UADJ,UTI Asset Management Company Ltd (UTISENSETF) Unadjusted Stock Prices
XNSE/UTINIFTETF_UADJ,UTI Asset Management Company Ltd (UTINIFTETF) Unadjusted Stock Prices
XNSE/SMOPAL_UADJ,Opal Luxury Time Products Ltd (SMOPAL) Unadjusted Stock Prices
XNSE/MFRELDUALGPA_UADJ,Reliance Capital Asset Management Ltd (MFRELDUALGPA) Unadjusted Stock Prices
XNSE/GLORY_UADJ,Glory Films Ltd (GLORY) Unadjusted Stock Prices
XNSE/BLUEBLENDS_UADJ,Blue Blends (India) Ltd. (BLUEBLENDS) Unadjusted Stock Prices
XNSE/AXISCADES_UADJ,AXISCADES Engineering Technologies Ltd (AXISCADES) Unadjusted Stock Prices
XNSE/BGLOBAL_UADJ,Bharatiya Global Infomedia Ltd (BGLOBAL) Unadjusted Stock Prices
XNSE/CGCL_UADJ,Capri Global Capital Ltd (CGCL) Unadjusted Stock Prices
XNSE/MERCATOR_UADJ,Mercator Ltd (MERCATOR) Unadjusted Stock Prices
XNSE/N4SRTRANSFIN_UADJ,Shriram Transport Finance Co. Ltd. (N4SRTRANSFIN) Unadjusted Stock Prices
XNSE/KALINDEE_UADJ,Kalindee Rail Nirman (Engineers) Ltd. (KALINDEE) Unadjusted Stock Prices
XNSE/ERAINFRA_UADJ,Era Infra Engineering Ltd. (ERAINFRA) Unadjusted Stock Prices
XNSE/UMESLTD_UADJ,Usha Martin Education & Solutions Ltd (UMESLTD) Unadjusted Stock Prices
XNSE/INDIANB_UADJ,Indian Bank (INDIANB) Unadjusted Stock Prices
XNSE/SPECTACLE_UADJ,Spectacle Ventures Ltd (SPECTACLE) Unadjusted Stock Prices
XNSE/TATACHEM_UADJ,Tata Chemicals Ltd. (TATACHEM) Unadjusted Stock Prices
XNSE/JPASSOCIAT_UADJ,Jaiprakash Associates Ltd. (JPASSOCIAT) Unadjusted Stock Prices
XNSE/SPYL_UADJ,Shekhawati Poly-Yarn Limited (SPYL) Unadjusted Stock Prices
XNSE/TIIL_UADJ,Technocraft Industries (India) Ltd. (TIIL) Unadjusted Stock Prices
XNSE/N1IIFLFIN_UADJ,India Infoline Finance Ltd (N1IIFLFIN) Unadjusted Stock Prices
XNSE/MAX_UADJ,Max Financial Services Ltd. (MAX) Unadjusted Stock Prices
XNSE/ATULAUTO_UADJ,Atul Auto Ltd. (ATULAUTO) Unadjusted Stock Prices
XNSE/SHASUNPHAR_UADJ,Shasun Pharmaceuticals Ltd (SHASUNPHAR) Unadjusted Stock Prices
XNSE/MANAKALUCO_UADJ,Manaksia Aluminium Co. Ltd. (MANAKALUCO) Unadjusted Stock Prices
XNSE/SUNPHARMA_UADJ,Sun Pharmaceutical Industries Ltd. (SUNPHARMA) Unadjusted Stock Prices
XNSE/ZEEL_UADJ,Zee Entertainment Enterprises Ltd (ZEEL) Unadjusted Stock Prices
XNSE/HOVS_UADJ,HOV Services Ltd. (HOVS) Unadjusted Stock Prices
XNSE/BURNPUR_UADJ,Burnpur Cement Ltd. (BURNPUR) Unadjusted Stock Prices
XNSE/PDUMJEPULP_UADJ,Pudumjee Pulp & Paper Mills Ltd. (PDUMJEPULP) Unadjusted Stock Prices
XNSE/SOBHA_UADJ,Sobha Ltd. (SOBHA) Unadjusted Stock Prices
XNSE/ASHAPURMIN_UADJ,Ashapura Minechem Ltd. (ASHAPURMIN) Unadjusted Stock Prices
XNSE/SOLARINDS_UADJ,Solar Industries India Ltd (SOLARINDS) Unadjusted Stock Prices
XNSE/GREAVESCOT_UADJ,Greaves Cotton Ltd. (GREAVESCOT) Unadjusted Stock Prices
XNSE/AFL_UADJ,Accel Frontline Ltd. (AFL) Unadjusted Stock Prices
XNSE/UPL_UADJ,UPL Ltd (UPL) Unadjusted Stock Prices
XNSE/NBVENTURES_UADJ,Nava Bharat Ventures Ltd. (NBVENTURES) Unadjusted Stock Prices
XNSE/CELEBRITY_UADJ,Celebrity Fashions Ltd. (CELEBRITY) Unadjusted Stock Prices
XNSE/DHANBANK_UADJ,Dhanlaxmi Bank Ltd. (DHANBANK) Unadjusted Stock Prices
XNSE/KANORICHEM_UADJ,Kanoria Chemicals & Industries Ltd. (KANORICHEM) Unadjusted Stock Prices
XNSE/ZENITHINFO_UADJ,Zenith Infotech Ltd. (ZENITHINFO) Unadjusted Stock Prices
XNSE/CUB_UADJ,City Union Bank Ltd. (CUB) Unadjusted Stock Prices
XNSE/SHIRPUR_G_UADJ,Shirpur Gold Refinery Ltd. (SHIRPUR-G) Unadjusted Stock Prices
XNSE/IOLCP_UADJ,IOL Chemicals & Pharmaceuticals Ltd. (IOLCP) Unadjusted Stock Prices
XNSE/FIRSTWIN_UADJ,First Winner Industries Ltd (FIRSTWIN) Unadjusted Stock Prices
XNSE/TECHM_UADJ,Tech Mahindra Ltd. (TECHM) Unadjusted Stock Prices
XNSE/PRISMCEM_UADJ,Prism Cement Ltd. (PRISMCEM) Unadjusted Stock Prices
XNSE/APLAB_UADJ,Aplab Ltd. (APLAB) Unadjusted Stock Prices
XNSE/GREENPOWER_UADJ,Orient Green Power Company Limited (GREENPOWER) Unadjusted Stock Prices
XNSE/PIRPHYTO_UADJ,Piramal Phytocare Ltd (PIRPHYTO) Unadjusted Stock Prices
XNSE/JINDRILL_UADJ,Jindal Drilling & Industries Ltd. (JINDRILL) Unadjusted Stock Prices
XNSE/SDBL_UADJ,Som Distilleries & Breweries Ltd. (SDBL) Unadjusted Stock Prices
XNSE/MASTEK_UADJ,Mastek Ltd. (MASTEK) Unadjusted Stock Prices
XNSE/RELDIVOPP_UADJ,Reliance Nippon Life Asset Management Ltd. (RELDIVOPP) Unadjusted Stock Prices
XNSE/ORIENTREF_UADJ,Orient Refractories Ltd (ORIENTREF) Unadjusted Stock Prices
XNSE/N2SBIN_UADJ,State Bank of India (N2SBIN) Unadjusted Stock Prices
XNSE/MFFTFTF15GR_UADJ,Franklin Templeton Asset Management (India) Private Limited (MFFTFTF15GR) Unadjusted Stock Prices
XNSE/ALKYLAMINE_UADJ,Alkyl Amines Chemicals Ltd. (ALKYLAMINE) Unadjusted Stock Prices
XNSE/LUPIN_UADJ,Lupin Ltd (LUPIN) Unadjusted Stock Prices
XNSE/MFIIFLFMPS1G_UADJ,India Infoline Asset Management Co. Ltd (MFIIFLFMPS1G) Unadjusted Stock Prices
XNSE/XPROINDIA_UADJ,Xpro India Ltd. (XPROINDIA) Unadjusted Stock Prices
XNSE/ANSALHSG_UADJ,Ansal Housing & Construction Ltd. (ANSALHSG) Unadjusted Stock Prices
XNSE/MUTHOOTCAP_UADJ,Muthoot Capital Services Ltd. (MUTHOOTCAP) Unadjusted Stock Prices
XNSE/HYDROS_S_UADJ,Hydro S&S Industries Ltd. (HYDROS.S) Unadjusted Stock Prices
XNSE/VIMTALABS_UADJ,Vimta Labs Ltd. (VIMTALABS) Unadjusted Stock Prices
XNSE/PUNJABTRAC_UADJ,Punjab Tractors Ltd. (PUNJABTRAC) Unadjusted Stock Prices
XNSE/AKSHOPTFBR_UADJ,Aksh Optifibre Ltd. (AKSHOPTFBR) Unadjusted Stock Prices
XNSE/RAMANEWS_UADJ,Shree Rama Newsprint Ltd (RAMANEWS) Unadjusted Stock Prices
XNSE/ZANDUREALT_UADJ,Zandu Realty Ltd (ZANDUREALT) Unadjusted Stock Prices
XNSE/XLENERGY_UADJ,XL Energy Ltd. (XLENERGY) Unadjusted Stock Prices
XNSE/N3HUDCO_UADJ,Housing & Urban Development Corporation. (N3HUDCO) Unadjusted Stock Prices
XNSE/SPICEMOBI_UADJ,Spice Mobility Ltd (SPICEMOBI) Unadjusted Stock Prices
XNSE/PRESTIGE_UADJ,Prestige Estates Projects Limited (PRESTIGE) Unadjusted Stock Prices
XNSE/RPGTLTD_UADJ,RPG Transmission Ltd. (RPGTLTD) Unadjusted Stock Prices
XNSE/PHILCORP_UADJ,Kore Foods Ltd. (PHILCORP) Unadjusted Stock Prices
XNSE/CARERATING_UADJ,CARE Ratings Ltd. (CARERATING) Unadjusted Stock Prices
XNSE/N4RELIFIN_UADJ,Religare Finvest Limited (N4RELIFIN) Unadjusted Stock Prices
XNSE/JINDCOT_UADJ,Jindal Cotex Limited. (JINDCOT) Unadjusted Stock Prices
XNSE/DEEPAKFERT_UADJ,Deepak Fertilisers & Petrochemicals Corp. Ltd. (DEEPAKFERT) Unadjusted Stock Prices
XNSE/MFIPRU1772_UADJ,ICICI Prudential Asset Management Company Ltd. (MFIPRU1772) Unadjusted Stock Prices
XNSE/MRO_TEK_UADJ,MRO-TEK Realty Ltd. (MRO-TEK) Unadjusted Stock Prices
XNSE/N2RELIFIN_UADJ,Religare Finvest Limited (N2RELIFIN) Unadjusted Stock Prices
XNSE/SMSIIL_UADJ,Supreme (India) Impex Ltd. (SMSIIL) Unadjusted Stock Prices
XNSE/BBTC_UADJ,Bombay Burmah Trading Corporation Ltd. (BBTC) Unadjusted Stock Prices
XNSE/NORBTEAEXP_UADJ,Norben Tea & Exports Ltd. (NORBTEAEXP) Unadjusted Stock Prices
XNSE/VIKASGLOB_UADJ,Vikas EcoTech Ltd. (VIKASGLOB) Unadjusted Stock Prices
XNSE/FAGBEARING_UADJ,Fag Bearings (India) Ltd. (FAGBEARING) Unadjusted Stock Prices
XNSE/NGCT_UADJ,Spacenet Enterprises India Ltd. (NGCT) Unadjusted Stock Prices
XNSE/LYKALABS_UADJ,Lyka Labs Ltd. (LYKALABS) Unadjusted Stock Prices
XNSE/WALCHANNAG_UADJ,Walchandnagar Industries Ltd. (WALCHANNAG) Unadjusted Stock Prices
XNSE/RELIGARE_UADJ,Religare Enterprises Ltd. (RELIGARE) Unadjusted Stock Prices
XNSE/SUZLON_UADJ,Suzlon Energy Ltd. (SUZLON) Unadjusted Stock Prices
XNSE/SINTEX_UADJ,Sintex Industries Ltd. (SINTEX) Unadjusted Stock Prices
XNSE/EIHOTEL_UADJ,EIH Ltd. (EIHOTEL) Unadjusted Stock Prices
XNSE/RBL_UADJ,Rane Brake Lining Ltd (RBL) Unadjusted Stock Prices
XNSE/BANCOINDIA_UADJ,Banco Products (India) Ltd. (BANCOINDIA) Unadjusted Stock Prices
XNSE/VESUVIUS_UADJ,Vesuvius India Ltd. (VESUVIUS) Unadjusted Stock Prices
XNSE/PERSISTENT_UADJ,Persistent Systems Ltd. (PERSISTENT) Unadjusted Stock Prices
XNSE/RAJOIL_UADJ,Raj Oil Mills Ltd (RAJOIL) Unadjusted Stock Prices
XNSE/HARRMALAYA_UADJ,Harrisons Malayalam Ltd. (HARRMALAYA) Unadjusted Stock Prices
XNSE/MINDTREE_UADJ,MindTree Ltd (MINDTREE) Unadjusted Stock Prices
XNSE/MFUFTFGR15PX_UADJ,UTI Asset Management Company Ltd (MFUFTFGR15PX) Unadjusted Stock Prices
XNSE/HTMEDIA_UADJ,HT Media Ltd. (HTMEDIA) Unadjusted Stock Prices
XNSE/GOLDBEES_UADJ,Goldman Sachs Asset Management (India) Pvt. Ltd. (GOLDBEES) Unadjusted Stock Prices
XNSE/AGRITECH_UADJ,Agri-Tech (India) Ltd. (AGRITECH) Unadjusted Stock Prices
XNSE/SEZAL_UADJ,Sejal Glass Ltd (SEZAL) Unadjusted Stock Prices
XNSE/OISL_UADJ,OCL Iron & Steel Ltd (OISL) Unadjusted Stock Prices
XNSE/ISMTLTD_UADJ,ISMT Ltd. (ISMTLTD) Unadjusted Stock Prices
XNSE/SETFNIFTY_UADJ,SBI Funds Management Private Limited (SETFNIFTY) Unadjusted Stock Prices
XNSE/CLASSIC_UADJ,Classic Diamonds (India) Ltd. (CLASSIC) Unadjusted Stock Prices
XNSE/JMCPROJECT_UADJ,JMC Projects (India) Ltd. (JMCPROJECT) Unadjusted Stock Prices
XNSE/CHENNPETRO_UADJ,Chennai Petroleum Corporation Ltd. (CHENNPETRO) Unadjusted Stock Prices
XNSE/ACROPETAL_UADJ,Acropetal Technologies Ltd (ACROPETAL) Unadjusted Stock Prices
XNSE/PSTL_UADJ,Pyramid Saimira Theatre Ltd. (PSTL) Unadjusted Stock Prices
XNSE/TGBHOTELS_UADJ,TGB Banquets & Hotels Ltd (TGBHOTELS) Unadjusted Stock Prices
XNSE/WELENTRP_UADJ,Welspun Enterprises Ltd (WELENTRP) Unadjusted Stock Prices
XNSE/WANBURY_UADJ,Wanbury Ltd. (WANBURY) Unadjusted Stock Prices
XNSE/ORTINLABSS_UADJ,Ortin Laboratories Ltd. (ORTINLABSS) Unadjusted Stock Prices
XNSE/SESHAPAPER_UADJ,Seshasayee Paper & Boards Ltd. (SESHAPAPER) Unadjusted Stock Prices
XNSE/THOMASCOTT_UADJ,Thomas Scott (India) Ltd (THOMASCOTT) Unadjusted Stock Prices
XNSE/MOTHERSUMI_UADJ,Motherson Sumi Systems Ltd. (MOTHERSUMI) Unadjusted Stock Prices
XNSE/ALLCARGO_UADJ,Allcargo Logistics Ltd (ALLCARGO) Unadjusted Stock Prices
XNSE/BALRAMCHIN_UADJ,Balrampur Chini Mills Ltd. (BALRAMCHIN) Unadjusted Stock Prices
XNSE/PRITHVISOF_UADJ,Prithvi Softech Ltd. (PRITHVISOF) Unadjusted Stock Prices
XNSE/RAJRAYON_UADJ,Raj Rayon Industries Ltd. (RAJRAYON) Unadjusted Stock Prices
XNSE/DLINKINDIA_UADJ,D-Link (India) Ltd. (DLINKINDIA) Unadjusted Stock Prices
XNSE/UNITEDBNK_UADJ,United Bank of India (UNITEDBNK) Unadjusted Stock Prices
XNSE/N1COROMANDEL_UADJ,Coromandel International Ltd (N1COROMANDEL) Unadjusted Stock Prices
XNSE/JKLAKSHMI_UADJ,JK Lakshmi Cement Ltd. (JKLAKSHMI) Unadjusted Stock Prices
XNSE/ORIENTHOT_UADJ,Oriental Hotels Ltd. (ORIENTHOT) Unadjusted Stock Prices
XNSE/GSS_UADJ,GSS Infotech Ltd. (GSS) Unadjusted Stock Prices
XNSE/GRUH_UADJ,GRUH Finance Ltd. (GRUH) Unadjusted Stock Prices
XNSE/ALBK_UADJ,Allahabad Bank (ALBK) Unadjusted Stock Prices
XNSE/ANDHRACEMT_UADJ,Andhra Cements Ltd. (ANDHRACEMT) Unadjusted Stock Prices
XNSE/SMSHAIVAL_UADJ,Shaival Reality Ltd. (SMSHAIVAL) Unadjusted Stock Prices
XNSE/KRBL_UADJ,KRBL Ltd. (KRBL) Unadjusted Stock Prices
XNSE/SARDAEN_UADJ,Sarda Energy & Minerals Ltd. (SARDAEN) Unadjusted Stock Prices
XNSE/JKCEMENT_UADJ,J.K. Cement Ltd. (JKCEMENT) Unadjusted Stock Prices
XNSE/CREWBOS_UADJ,Crew B.O.S. Products Ltd. (CREWBOS) Unadjusted Stock Prices
XNSE/BASF_UADJ,BASF India Ltd. (BASF) Unadjusted Stock Prices
XNSE/KFA_UADJ,Kingfisher Airlines Ltd (KFA) Unadjusted Stock Prices
XNSE/BALKRISIND_UADJ,Balkrishna Industries Ltd. (BALKRISIND) Unadjusted Stock Prices
XNSE/ORIENTBANK_UADJ,Oriental Bank of Commerce (ORIENTBANK) Unadjusted Stock Prices
XNSE/MFIIFLFMPS3G_UADJ,India Infoline Asset Management Co. Ltd (MFIIFLFMPS3G) Unadjusted Stock Prices
XNSE/W1OUDHSUG_UADJ,Oudh Sugar Mills Ltd. (W1OUDHSUG) Unadjusted Stock Prices
XNSE/MFUTIFEFRGR1_UADJ,UTI Asset Management Company Ltd (MFUTIFEFRGR1) Unadjusted Stock Prices
XNSE/ANKITMETAL_UADJ,Ankit Metal & Power Ltd. (ANKITMETAL) Unadjusted Stock Prices
XNSE/GLOBUSSPR_UADJ,Globus Spirits Ltd (GLOBUSSPR) Unadjusted Stock Prices
XNSE/N1JNPT_UADJ,Jawaharlal Nehru Port Trust (N1JNPT) Unadjusted Stock Prices
XNSE/UNITY_UADJ,Unity Infraprojects Ltd. (UNITY) Unadjusted Stock Prices
XNSE/P1ZEEL_UADJ,Zee Entertainment Enterprises Ltd (P1ZEEL) Unadjusted Stock Prices
XNSE/ADANIENT_UADJ,Adani Enterprises Ltd (ADANIENT) Unadjusted Stock Prices
XNSE/WSI_UADJ,W.S. Industries (India) Ltd. (WSI) Unadjusted Stock Prices
XNSE/PRATIBHA_UADJ,Pratibha Industries Ltd. (PRATIBHA) Unadjusted Stock Prices
XNSE/MADHAV_UADJ,Madhav Marbles & Granites Ltd. (MADHAV) Unadjusted Stock Prices
XNSE/OMKARCHEM_UADJ,Omkar Speciality Chemicals Ltd (OMKARCHEM) Unadjusted Stock Prices
XNSE/SWANENERGY_UADJ,Swan Energy Ltd (SWANENERGY) Unadjusted Stock Prices
XNSE/ELECON_UADJ,Elecon Engineering Co. Ltd. (ELECON) Unadjusted Stock Prices
XNSE/GTLINFRA_UADJ,GTL Infrastucture Ltd (GTLINFRA) Unadjusted Stock Prices
XNSE/ZENITHCOMP_UADJ,Zenith Computer Ltd. (ZENITHCOMP) Unadjusted Stock Prices
XNSE/TULIP_UADJ,Tulip Telecom Ltd (TULIP) Unadjusted Stock Prices
XNSE/CMC_UADJ,CMC Ltd. (CMC) Unadjusted Stock Prices
XNSE/ICSA_UADJ,I.C.S.A (India) Ltd (ICSA) Unadjusted Stock Prices
XNSE/INIFTY_UADJ,ICICI Prudential Asset Management Company Ltd. (INIFTY) Unadjusted Stock Prices
XNSE/GAL_UADJ,Gyscoal Alloys Ltd (GAL) Unadjusted Stock Prices
XNSE/SHAKTIPUMP_UADJ,Shakti Pumps (India) Ltd. (SHAKTIPUMP) Unadjusted Stock Prices
XNSE/PRIMESECU_UADJ,Prime Securities Ltd. (PRIMESECU) Unadjusted Stock Prices
XNSE/BIRLACOT_UADJ,Birla Cotsyn (India) Ltd (BIRLACOT) Unadjusted Stock Prices
XNSE/MENONBE_UADJ,Menon Bearings Ltd. (MENONBE) Unadjusted Stock Prices
XNSE/N6SRTRANSFIN_UADJ,Shriram Transport Finance Co. Ltd. (N6SRTRANSFIN) Unadjusted Stock Prices
XNSE/AHLUCONT_UADJ,Ahluwalia Contracts (India) Ltd. (AHLUCONT) Unadjusted Stock Prices
XNSE/PVP_UADJ,PVP Ventures Ltd (PVP) Unadjusted Stock Prices
XNSE/SATYAMCOMP_UADJ,Satyam Computer Services Ltd. (SATYAMCOMP) Unadjusted Stock Prices
XNSE/SRF_UADJ,SRF Ltd. (SRF) Unadjusted Stock Prices
XNSE/SANGHVIFOR_UADJ,Sanghvi Forging and Engineering Ltd (SANGHVIFOR) Unadjusted Stock Prices
XNSE/MANAKSTEEL_UADJ,Manaksia Steels Ltd. (MANAKSTEEL) Unadjusted Stock Prices
XNSE/ITDCEM_UADJ,ITD Cementation India Ltd. (ITDCEM) Unadjusted Stock Prices
XNSE/SURANAT_P_UADJ,Surana Telecom and Power Ltd. (SURANAT&P) Unadjusted Stock Prices
XNSE/MARALOVER_UADJ,Maral Overseas Ltd. (MARALOVER) Unadjusted Stock Prices
XNSE/KESORAMIND_UADJ,Kesoram Industries Ltd. (KESORAMIND) Unadjusted Stock Prices
XNSE/TRICOM_UADJ,Tricom India Ltd (TRICOM) Unadjusted Stock Prices
XNSE/ZENITHBIR_UADJ,Zenith Birla (India) Ltd (ZENITHBIR) Unadjusted Stock Prices
XNSE/LUMAXAUTO_UADJ,Lumax Automotive Systems Ltd. (LUMAXAUTO) Unadjusted Stock Prices
XNSE/RPPINFRA_UADJ,R.P.P. Infra Projects Limited (RPPINFRA) Unadjusted Stock Prices
XNSE/SURANACORP_UADJ,Surana Corporation Ltd. (SURANACORP) Unadjusted Stock Prices
XNSE/N8RELIFIN_UADJ,Religare Finvest Limited (N8RELIFIN) Unadjusted Stock Prices
XNSE/COMPUSOFT_UADJ,Compucom Software Ltd. (COMPUSOFT) Unadjusted Stock Prices
XNSE/UTVSOF_UADJ,UTV Software Communications Ltd. (UTVSOF) Unadjusted Stock Prices
XNSE/N1MUTHOOTFIN_UADJ,Muthoot Finance Ltd. (N1MUTHOOTFIN) Unadjusted Stock Prices
XNSE/CUBEXTUB_UADJ,Cubex Tubings Ltd. (CUBEXTUB) Unadjusted Stock Prices
XNSE/NBSHRIRAMCIT_UADJ,Shriram City Union Finance Ltd. (NBSHRIRAMCIT) Unadjusted Stock Prices
XNSE/TEXINFRA_UADJ,Texmaco Infrastructure & Holdings Ltd (TEXINFRA) Unadjusted Stock Prices
XNSE/RELCNX100_UADJ,Reliance Nippon Life Asset Management Ltd. (RELCNX100) Unadjusted Stock Prices
XNSE/BAJAJELEC_UADJ,Bajaj Electricals Ltd. (BAJAJELEC) Unadjusted Stock Prices
XNSE/MAHSEAMLES_UADJ,Maharashtra Seamless Ltd. (MAHSEAMLES) Unadjusted Stock Prices
XNSE/REPCOHOME_UADJ,Repco Home Finance Ltd (REPCOHOME) Unadjusted Stock Prices
XNSE/JAICORPLTD_UADJ,Jai Corp Ltd. (JAICORPLTD) Unadjusted Stock Prices
XNSE/ASHOKA_UADJ,Ashoka Buildcon Ltd (ASHOKA) Unadjusted Stock Prices
XNSE/GABRIEL_UADJ,Gabriel India Ltd. (GABRIEL) Unadjusted Stock Prices
XNSE/SUNCLAYLTD_UADJ,Sundaram-Clayton Ltd. (SUNCLAYLTD) Unadjusted Stock Prices
XNSE/NOL_UADJ,National Oxygen Ltd. (NOL) Unadjusted Stock Prices
XNSE/ADHUNIK_UADJ,Adhunik Metaliks Ltd. (ADHUNIK) Unadjusted Stock Prices
XNSE/ESTL_UADJ,Essar Steel Ltd. (ESTL) Unadjusted Stock Prices
XNSE/GANECOS_UADJ,Ganesha Ecosphere Ltd (GANECOS) Unadjusted Stock Prices
XNSE/SITASHREE_UADJ,Sita Shree Food Products Ltd (SITASHREE) Unadjusted Stock Prices
XNSE/MFFTFTF13ADV_UADJ,Franklin Templeton Asset Management (India) Private Limited (MFFTFTF13ADV) Unadjusted Stock Prices
XNSE/IT3RDROCK_UADJ,3rd Rock Multimedia Ltd. (IT3RDROCK) Unadjusted Stock Prices
XNSE/RUCHIRA_UADJ,Ruchira Papers Ltd. (RUCHIRA) Unadjusted Stock Prices
XNSE/REISIXTEN_UADJ,REI Six Ten Retail Ltd (REISIXTEN) Unadjusted Stock Prices
XNSE/MFJ301G_UADJ,JP Morgan Asset Management India Pvt Ltd (MFJ301G) Unadjusted Stock Prices
XNSE/GUFICBIO_UADJ,Gufic Biosciences Ltd. (GUFICBIO) Unadjusted Stock Prices
XNSE/E1ABAN_UADJ,Aban Offshore Ltd. (E1ABAN) Unadjusted Stock Prices
XNSE/COROENGG_UADJ,Coromandel Engineering Co. Ltd. (COROENGG) Unadjusted Stock Prices
XNSE/TARAJEWELS_UADJ,Tara Jewels Ltd (TARAJEWELS) Unadjusted Stock Prices
XNSE/A2ZINFRA_UADJ,A2Z Infra Engineering Ltd. (A2ZINFRA) Unadjusted Stock Prices
XNSE/AHLEAST_UADJ,Asian Hotels (East) Ltd (AHLEAST) Unadjusted Stock Prices
XNSE/WABCOINDIA_UADJ,WABCO India Ltd (WABCOINDIA) Unadjusted Stock Prices
XNSE/KOKUYOCMLN_UADJ,Kokuyo Camlin Ltd (KOKUYOCMLN) Unadjusted Stock Prices
XNSE/SWELECTES_UADJ,Swelect Energy Systems Ltd (SWELECTES) Unadjusted Stock Prices
XNSE/W1GREENPLY_UADJ,Greenply Industries Ltd. (W1GREENPLY) Unadjusted Stock Prices
XNSE/MAJESCO_UADJ,Majesco Ltd (MAJESCO) Unadjusted Stock Prices
XNSE/VIPULLTD_UADJ,Vipul Ltd. (VIPULLTD) Unadjusted Stock Prices
XNSE/SONASTEER_UADJ,Sona Koyo Steering Systems Ltd. (SONASTEER) Unadjusted Stock Prices
XNSE/NOCIL_UADJ,NOCIL Ltd. (NOCIL) Unadjusted Stock Prices
XNSE/FDC_UADJ,FDC Ltd. (FDC) Unadjusted Stock Prices
XNSE/IIFLNIFTY_UADJ,India Infoline Asset Management Co. Ltd (IIFLNIFTY) Unadjusted Stock Prices
XNSE/KINETICMOT_UADJ,Kinetic Motor Co. Ltd. (KINETICMOT) Unadjusted Stock Prices
XNSE/SURYAROSNI_UADJ,Surya Roshni Ltd. (SURYAROSNI) Unadjusted Stock Prices
XNSE/AJMERA_UADJ,Ajmera Realty & Infra India Ltd (AJMERA) Unadjusted Stock Prices
XNSE/SUBEX_UADJ,Subex Ltd. (SUBEX) Unadjusted Stock Prices
XNSE/GULFOILLUB_UADJ,Gulf Oil Lubricants India Ltd (GULFOILLUB) Unadjusted Stock Prices
XNSE/CHOLAFIN_UADJ,Cholamandalam Investment and Finance Company Ltd. (CHOLAFIN) Unadjusted Stock Prices
XNSE/ELGIEQUIP_UADJ,Elgi Equipments Ltd. (ELGIEQUIP) Unadjusted Stock Prices
XNSE/GSKCONS_UADJ,GlaxoSmithkline Consumer Healthcare Ltd. (GSKCONS) Unadjusted Stock Prices
XNSE/KARMAENG_UADJ,Karma Energy Ltd. (KARMAENG) Unadjusted Stock Prices
XNSE/PITTILAM_UADJ,Pitti Laminations Ltd. (PITTILAM) Unadjusted Stock Prices
XNSE/NIPPOBATRY_UADJ,Indo-National Ltd (NIPPOBATRY) Unadjusted Stock Prices
XNSE/GPIL_UADJ,Godawari Power & Ispat Ltd. (GPIL) Unadjusted Stock Prices
XNSE/VIJAYABANK_UADJ,Vijaya Bank (VIJAYABANK) Unadjusted Stock Prices
XNSE/TDPOWERSYS_UADJ,TD Power Systems Ltd (TDPOWERSYS) Unadjusted Stock Prices
XNSE/RAMSARUP_UADJ,Ramsarup Industries Ltd. (RAMSARUP) Unadjusted Stock Prices
XNSE/NHPC_UADJ,NHPC Limited (NHPC) Unadjusted Stock Prices
XNSE/ANKURDRUGS_UADJ,Ankur Drugs & Pharma Ltd. (ANKURDRUGS) Unadjusted Stock Prices
XNSE/RSSOFTWARE_UADJ,R.S Software (India) Ltd. (RSSOFTWARE) Unadjusted Stock Prices
XNSE/RAYMOND_UADJ,Raymond Ltd. (RAYMOND) Unadjusted Stock Prices
XNSE/RAJVIR_UADJ,Rajvir Industries Ltd. (RAJVIR) Unadjusted Stock Prices
XNSE/RJL_UADJ,Renaissance Jewellery Ltd. (RJL) Unadjusted Stock Prices
XNSE/VAIBHAVGBL_UADJ,Vaibhav Global Ltd (VAIBHAVGBL) Unadjusted Stock Prices
XNSE/LCCINFOTEC_UADJ,LCC Infotech Ltd. (LCCINFOTEC) Unadjusted Stock Prices
XNSE/MYSOREBANK_UADJ,State Bank of Mysore (MYSOREBANK) Unadjusted Stock Prices
XNSE/E1TV_18_UADJ,Television Eighteen India Ltd. (E1TV.18) Unadjusted Stock Prices
XNSE/ITMRO_UADJ,M.R. Organisation Ltd (ITMRO) Unadjusted Stock Prices
XNSE/BOSCHLTD_UADJ,Bosch Ltd. (BOSCHLTD) Unadjusted Stock Prices
XNSE/BIRLAERIC_UADJ,Birla Cable Ltd (BIRLAERIC) Unadjusted Stock Prices
XNSE/BHARATRAS_UADJ,Bharat Rasayan Ltd. (BHARATRAS) Unadjusted Stock Prices
XNSE/ABCIL_UADJ,Aditya Birla Chemicals (India) Ltd (ABCIL) Unadjusted Stock Prices
XNSE/BSLNIFTY_UADJ,Birla Sun Life Asset Management Company Ltd (BSLNIFTY) Unadjusted Stock Prices
XNSE/MANGALAM_UADJ,Mangalam Drugs & Organics Ltd. (MANGALAM) Unadjusted Stock Prices
XNSE/ADORWELD_UADJ,Ador Welding Ltd. (ADORWELD) Unadjusted Stock Prices
XNSE/ITC_UADJ,ITC Ltd. (ITC) Unadjusted Stock Prices
XNSE/TRITURBINE_UADJ,Triveni Turbine Ltd. (TRITURBINE) Unadjusted Stock Prices
XNSE/CENTEXT_UADJ,Century Extrusions Ltd. (CENTEXT) Unadjusted Stock Prices
XNSE/PNCINFRA_UADJ,PNC Infratech Ltd. (PNCINFRA) Unadjusted Stock Prices
XNSE/SMZSCHEM_UADJ,SMZS Chemicals Ltd. (SMZSCHEM) Unadjusted Stock Prices
XNSE/SURANASOL_UADJ,Surana Solar Ltd. (SURANASOL) Unadjusted Stock Prices
XNSE/RKFORGE_UADJ,Ramkrishna Forgings Ltd. (RKFORGE) Unadjusted Stock Prices
XNSE/MATRIXLABS_UADJ,Matrix Laboratories Ltd. (MATRIXLABS) Unadjusted Stock Prices
XNSE/NRC_UADJ,NRC Ltd. (NRC) Unadjusted Stock Prices
XNSE/HDFCBANK_UADJ,HDFC Bank Ltd. (HDFCBANK) Unadjusted Stock Prices
XNSE/MAANALU_UADJ,Maan Aluminium Ltd (MAANALU) Unadjusted Stock Prices
XNSE/MFRFHFXXI18G_UADJ,Reliance Capital Asset Management Ltd (MFRFHFXXI18G) Unadjusted Stock Prices
XNSE/BELLCERATL_UADJ,Bell Ceramics Ltd. (BELLCERATL) Unadjusted Stock Prices
XNSE/RBN_UADJ,Reliance Broadcast Network Ltd (RBN) Unadjusted Stock Prices
XNSE/E2CUB_UADJ,City Union Bank Ltd. (E2CUB) Unadjusted Stock Prices
XNSE/WELINV_UADJ,Welspun Investments & Commercials Ltd (WELINV) Unadjusted Stock Prices
XNSE/SAGCEM_UADJ,Sagar Cements Ltd. (SAGCEM) Unadjusted Stock Prices
XNSE/IVP_UADJ,IVP Ltd. (IVP) Unadjusted Stock Prices
XNSE/IBREALEST_UADJ,Indiabulls Real Estate Ltd. (IBREALEST) Unadjusted Stock Prices
XNSE/BHARTISHIP_UADJ,Bharati Defence & Infrastructure Ltd (BHARTISHIP) Unadjusted Stock Prices
XNSE/SRIPIPES_UADJ,Srikalahasthi Pipes Ltd (SRIPIPES) Unadjusted Stock Prices
XNSE/ESTER_UADJ,Ester Industries Ltd. (ESTER) Unadjusted Stock Prices
XNSE/ZENTEC_UADJ,Zen Technologies Ltd. (ZENTEC) Unadjusted Stock Prices
XNSE/UNIVCABLES_UADJ,Universal Cables Ltd. (UNIVCABLES) Unadjusted Stock Prices
XNSE/SRHHYPOLTD_UADJ,Sree Rayalaseema Hi-Strength Hypo Ltd. (SRHHYPOLTD) Unadjusted Stock Prices
XNSE/REIAGROLTD_UADJ,REI Agro Ltd. (REIAGROLTD) Unadjusted Stock Prices
XNSE/COLORCHIPS_UADJ,Sphere Global Services Ltd (COLORCHIPS) Unadjusted Stock Prices
XNSE/RAJTV_UADJ,Raj Television Network Ltd. (RAJTV) Unadjusted Stock Prices
XNSE/W1JYOTISTRUC_UADJ,Jyoti Structures Ltd. (W1JYOTISTRUC) Unadjusted Stock Prices
